{"version": 21, "variables": [{"key": "CompanyName", "visible": true, "type": "query", "version": 2, "editable": true, "input": "fetch bizevents | filter event.kind == \"BIZ_EVENT\" | filter json.companyName == \"Telecommunications\" | fields json.companyName | dedup json.companyName", "multiple": false}, {"key": "JourneyType", "visible": true, "type": "query", "version": 2, "editable": true, "input": "fetch bizevents \n| filter json.companyName == $CompanyName\n| fields json.industryType | dedup json.industryType", "multiple": true}, {"key": "Step", "visible": true, "type": "query", "version": 2, "editable": true, "input": "fetch bizevents | filter event.kind == \"BIZ_EVENT\" | filter in(json.industryType, $JourneyType) | filter json.companyName == \"Telecommunications\" | fields json.stepName | dedup json.stepName", "multiple": true}, {"key": "Service", "visible": true, "type": "query", "version": 2, "editable": true, "input": "fetch bizevents\n| fields json.serviceName, json.companyName, json.industryType\n| summarize count(),by:{json.companyName, json.industryType, json.serviceName}\n| filter json.companyName == $CompanyName \n| filter in(json.industryType, $JourneyType)\n| dedup json.serviceName\n| fields json.serviceName = lower(json.serviceName)\n| filter isNotNull(json.serviceName)\n//| filter isNotNull(json.serviceName)\n\n", "multiple": true}, {"key": "PGI", "visible": true, "type": "query", "version": 2, "editable": true, "input": "smartscapeNodes PROCESS\n| lookup [smartscapeNodes SERVICE | fields id, name], sourceField:name, lookupField:name, prefix:\"svc.\"\n| lookup [timeseries cpu = avg(dt.process.cpu.usage), by:{dt.smartscape.process}], sourceField:id, lookupField:dt.smartscape.process, fields:{cpu}\n| filter isNotNull(cpu)\n//| fields dt.smartscape.process = id, name, cpu\n| fieldsAdd LowerService = lower(process.metadata[DYNATRACE_CLUSTER_ID])\n| filter in(LowerService, $Service)\n| fields id\n| dedup id", "multiple": true}], "tiles": {"0": {"type": "markdown", "content": "# Telecommunications\n## Support Request - Business Observability Dashboard\n\n**Industry:** Support Request | **Dashboard Type:** AI-Generated Bespoke Analytics\n**Data Signals Detected:** \ud83d\udd27 Services"}, "1": {"type": "markdown", "content": "## \ud83d\udd04 Customer Journey Flow\n\n**1. AppDiagnostics** (SelfService) **\u2192** **2. GuidedTroubleshooting** (SelfService) **\u2192** **3. ChatSupport** (Support) **\u2192** **4. EngineerBooking** (Scheduling) **\u2192** **5. EngineerVisit** (Resolution) **\u2192** **6. PostFixMonitoring** (Monitoring)\n\n---\n*End-to-end journey visualization with step-by-step metrics*"}, "2": {"title": "\ud83d\udcca Journey Step Metrics", "type": "data", "query": "fetch bizevents \n| filter event.kind == \"BIZ_EVENT\" \n| filter json.companyName == $CompanyName \n| filter json.industryType == $JourneyType \n| summarize \n    OrdersInStep = count(), \n    SuccessRate = round((toDouble(countIf(isNull(additionalfields.hasError) or additionalfields.hasError == false)) / toDouble(count())) * 100, decimals:2),\n    AvgTimeInStep = avg(additionalfields.processingTime),\n    ErrorsInStep = countIf(additionalfields.hasError == true),\n    ErrorRate = round((toDouble(countIf(additionalfields.hasError == true)) / toDouble(count())) * 100, decimals:2), \n    by: {json.stepName} \n| sort OrdersInStep desc", "visualization": "table", "visualizationSettings": {"table": {"columnWidths": {"json.stepName": 200, "OrdersInStep": 120, "SuccessRate": 120, "AvgTimeInStep": 120, "ErrorsInStep": 120, "ErrorRate": 120}}, "thresholds": [{"id": 1, "field": "SuccessRate", "isEnabled": true, "rules": [{"id": 1, "color": {"Default": "#2ab06f"}, "comparator": "\u2265", "value": 95}, {"id": 2, "color": {"Default": "#f5d30f"}, "comparator": "\u2265", "value": 85}, {"id": 3, "color": {"Default": "#dc2626"}, "comparator": "<", "value": 85}]}, {"id": 2, "field": "ErrorRate", "isEnabled": true, "rules": [{"id": 1, "color": {"Default": "#dc2626"}, "comparator": ">", "value": 5}, {"id": 2, "color": {"Default": "#f5d30f"}, "comparator": ">", "value": 2}, {"id": 3, "color": {"Default": "#2ab06f"}, "comparator": "\u2264", "value": 2}]}], "unitsOverrides": [{"identifier": "SuccessRate", "unitCategory": "percentage", "baseUnit": "percent", "displayUnit": null, "decimals": 3, "suffix": "%", "delimiter": true, "added": 1771077322092}, {"identifier": "AvgTimeInStep", "unitCategory": null, "baseUnit": null, "displayUnit": null, "decimals": 0, "suffix": "ms", "delimiter": true, "added": 1771077322092}, {"identifier": "ErrorRate", "unitCategory": "percentage", "baseUnit": "percent", "displayUnit": null, "decimals": 2, "suffix": "%", "delimiter": true, "added": 1771077322092}, {"identifier": "OrdersInStep", "unitCategory": "unspecified", "baseUnit": "count", "displayUnit": null, "decimals": 0, "suffix": "", "delimiter": true, "added": 1771077322092}]}, "querySettings": {"maxResultRecords": 1000, "defaultScanLimitGbytes": 500, "maxResultMegaBytes": 1, "defaultSamplingRatio": 10, "enableSampling": false}, "davis": {"enabled": false, "davisVisualization": {"isAvailable": true}}}, "3": {"title": "", "type": "data", "query": "data record(a=\"Overall Journey Performance - All Steps\")", "visualization": "singleValue", "visualizationSettings": {"singleValue": {"labelMode": "none", "isIconVisible": true, "prefixIcon": "RocketIcon", "colorThresholdTarget": "background"}, "thresholds": [{"id": 1, "field": "a", "isEnabled": true, "rules": [{"id": 1, "color": "#478ACA", "comparator": "!=", "value": "x"}]}]}, "querySettings": {"maxResultRecords": 1000, "defaultScanLimitGbytes": 500, "maxResultMegaBytes": 1, "defaultSamplingRatio": 10, "enableSampling": false}, "davis": {"davisVisualization": {"isAvailable": true}}}, "4": {"title": "\ud83d\udcc8 Total Journey Volume", "type": "data", "query": "fetch bizevents | filter event.kind == \"BIZ_EVENT\" | filter json.companyName == $CompanyName | filter json.industryType == $JourneyType | summarize TotalEvents = count()", "visualization": "singleValue", "visualizationSettings": {"singleValue": {"label": "TOTAL VOLUME", "recordField": "TotalEvents", "prefixIcon": "ActivityIcon", "colorThresholdTarget": "background"}, "thresholds": [], "unitsOverrides": [{"identifier": "TotalEvents", "unitCategory": "unspecified", "baseUnit": "count", "decimals": 0, "suffix": "", "delimiter": true, "added": 1771077322092}]}, "querySettings": {"maxResultRecords": 1000, "defaultScanLimitGbytes": 500, "maxResultMegaBytes": 1, "defaultSamplingRatio": 10, "enableSampling": false}, "davis": {"enabled": false, "davisVisualization": {"isAvailable": true}}}, "5": {"title": "\u2705 Journey Success Rate", "type": "data", "query": "fetch bizevents \n| filter event.kind == \"BIZ_EVENT\" \n| filter json.companyName == $CompanyName \n| filter json.industryType == $JourneyType \n| summarize total = count(), successful = countIf(isNull(additionalfields.hasError) or additionalfields.hasError == false) \n| fieldsAdd success_rate = round((toDouble(successful) / toDouble(total)) * 100, decimals:2)", "visualization": "singleValue", "visualizationSettings": {"singleValue": {"label": "SUCCESS RATE", "recordField": "success_rate", "prefixIcon": "CheckmarkIcon"}, "thresholds": [{"id": 1, "field": "success_rate", "isEnabled": true, "rules": [{"id": 1, "color": {"Default": "#2ab06f"}, "comparator": "\u2265", "value": 95}, {"id": 2, "color": {"Default": "#f5d30f"}, "comparator": "\u2265", "value": 85}, {"id": 3, "color": {"Default": "#dc2626"}, "comparator": "<", "value": 85}]}], "unitsOverrides": [{"identifier": "success_rate", "unitCategory": "percentage", "baseUnit": "percent", "decimals": 1, "suffix": "%", "delimiter": true, "added": 1771077322092}]}, "querySettings": {"maxResultRecords": 1000, "defaultScanLimitGbytes": 500, "maxResultMegaBytes": 1, "defaultSamplingRatio": 10, "enableSampling": false}, "davis": {"enabled": false, "davisVisualization": {"isAvailable": true}}}, "6": {"title": "\ud83d\udcb0 Total Revenue", "type": "data", "query": "fetch bizevents | filter event.kind == \"BIZ_EVENT\" | filter json.companyName == $CompanyName | filter json.industryType == $JourneyType or $JourneyType == \"*\" | summarize revenue = sum(additionalfields.orderTotal)", "visualization": "singleValue", "visualizationSettings": {"singleValue": {"label": "REVENUE", "recordField": "revenue", "prefixIcon": "MoneyIcon", "colorThresholdTarget": "background"}, "thresholds": [], "unitsOverrides": [{"identifier": "revenue", "unitCategory": "currency", "baseUnit": "usd", "decimals": 0, "suffix": "$", "delimiter": true, "added": 1771077322092}]}, "querySettings": {"maxResultRecords": 1000, "defaultScanLimitGbytes": 500, "maxResultMegaBytes": 1, "defaultSamplingRatio": 10, "enableSampling": false}, "davis": {"enabled": false, "davisVisualization": {"isAvailable": true}}}, "7": {"title": "\u274c Total Errors", "type": "data", "query": "fetch bizevents | filter event.kind == \"BIZ_EVENT\" | filter json.companyName == $CompanyName | filter json.industryType == $JourneyType or $JourneyType == \"*\" | summarize errors = countIf(additionalfields.hasError == true)", "visualization": "singleValue", "visualizationSettings": {"singleValue": {"label": "ERRORS", "recordField": "errors", "colorThresholdTarget": "background"}, "thresholds": [{"id": 1, "field": "errors", "isEnabled": true, "rules": [{"id": 1, "color": {"Default": "#dc2626"}, "comparator": ">", "value": 10}, {"id": 2, "color": {"Default": "#f5d30f"}, "comparator": ">", "value": 5}, {"id": 3, "color": {"Default": "#2ab06f"}, "comparator": "\u2264", "value": 5}]}], "unitsOverrides": [{"identifier": "errors", "unitCategory": "unspecified", "baseUnit": "count", "decimals": 0, "suffix": "", "delimiter": true, "added": 1771077322092}]}, "querySettings": {"maxResultRecords": 1000, "defaultScanLimitGbytes": 500, "maxResultMegaBytes": 1, "defaultSamplingRatio": 10, "enableSampling": false}, "davis": {"enabled": false, "davisV